<?xml version="1.0" encoding="UTF-8"?>
<Video
    name="favicon_spin_demo"
    width="1920"
    height="1080"
    fps="24"
    totalFrames="4"
    xmlns:xsi="http://www.w3.org/2001/XMLSchema-instance"
    xsi:noNamespaceSchemaLocation="render_dsl.xsd">

    <FRAME id="0" cameraX="0.0" cameraY="0.0">
        <SPRITE
            id="favicon_preview"
            image="favicon"
            x="960"
            y="540"
            anchorX="0.5"
            anchorY="0.5"
            scaleX="5"
            scaleY="5"
            rotation="0"
            alpha="1"
            visible="true"
            blendMode="normal"
            tint="0xffffff"
            zIndex="10"
        />
    </FRAME>

    <FRAME id="1" cameraX="0.0" cameraY="0.0">
        <SPRITE
            id="favicon_preview"
            image="favicon"
            x="980"
            y="540"
            anchorX="0.5"
            anchorY="0.5"
            scaleX="5"
            scaleY="5"
            rotation="0.35"
            alpha="0.95"
            visible="true"
            blendMode="normal"
            tint="0xffffff"
            zIndex="10"
        />
    </FRAME>

    <FRAME id="2" cameraX="0.0" cameraY="0.0">
        <SPRITE
            id="favicon_preview"
            image="favicon"
            x="960"
            y="560"
            anchorX="0.5"
            anchorY="0.5"
            scaleX="5"
            scaleY="5"
            rotation="0.7"
            alpha="0.9"
            visible="true"
            blendMode="normal"
            tint="0xffffff"
            zIndex="10"
        />
    </FRAME>

    <FRAME id="3" cameraX="0.0" cameraY="0.0">
        <SPRITE
            id="favicon_preview"
            image="favicon"
            x="940"
            y="540"
            anchorX="0.5"
            anchorY="0.5"
            scaleX="5"
            scaleY="5"
            rotation="1.05"
            alpha="0.95"
            visible="true"
            blendMode="normal"
            tint="0xffffff"
            zIndex="10"
        />
    </FRAME>
</Video>